[I 2025-07-19 13:16:44,534] A new study created in memory with name: no-name-9e4f634e-6ffb-45fd-8ba1-7802c2362f96
loading annotations into memory...
Done (t=0.02s)
creating index...
index created!
loading annotations into memory...
Done (t=0.01s)
creating index...
index created!
[I 2025-07-19 13:23:10,139] Trial 0 finished with value: 0.7258566978193146 and parameters: {'num_conv_layers': 2, 'conv_channels': 16, 'dropout_rate': 0.19672470414876578, 'linear_units': 320, 'learning_rate': 0.00825522457320092, 'optimizer': 'Adam', 'batch_size': 16, 'epochs': 6}. Best is trial 0 with value: 0.7258566978193146.
loading annotations into memory...
Done (t=0.02s)
creating index...
index created!
loading annotations into memory...
Done (t=0.01s)
creating index...
index created!
[I 2025-07-19 13:35:43,491] Trial 1 finished with value: 0.7601246105919003 and parameters: {'num_conv_layers': 2, 'conv_channels': 32, 'dropout_rate': 0.3127830374482312, 'linear_units': 192, 'learning_rate': 1.54817564062665e-05, 'optimizer': 'Adam', 'batch_size': 16, 'epochs': 8}. Best is trial 1 with value: 0.7601246105919003.
loading annotations into memory...
Done (t=0.02s)
creating index...
index created!
loading annotations into memory...
Done (t=0.01s)
creating index...
index created!
[I 2025-07-19 14:33:29,188] Trial 2 finished with value: 0.5358255451713395 and parameters: {'num_conv_layers': 1, 'conv_channels': 64, 'dropout_rate': 0.3500118795200702, 'linear_units': 256, 'learning_rate': 0.007942894126147642, 'optimizer': 'RMSprop', 'batch_size': 16, 'epochs': 15}. Best is trial 1 with value: 0.7601246105919003.
loading annotations into memory...
Done (t=0.03s)
creating index...
index created!
loading annotations into memory...
Done (t=0.01s)
creating index...
index created!
[I 2025-07-19 14:43:28,751] Trial 3 finished with value: 0.5342679127725857 and parameters: {'num_conv_layers': 3, 'conv_channels': 16, 'dropout_rate': 0.40857494863903043, 'linear_units': 320, 'learning_rate': 3.464570187428784e-05, 'optimizer': 'SGD', 'batch_size': 16, 'epochs': 11}. Best is trial 1 with value: 0.7601246105919003.
loading annotations into memory...
Done (t=0.02s)
creating index...
index created!
loading annotations into memory...
Done (t=0.01s)
creating index...
index created!
[I 2025-07-19 14:49:43,158] Trial 4 finished with value: 0.6246105919003115 and parameters: {'num_conv_layers': 1, 'conv_channels': 16, 'dropout_rate': 0.1309163920684208, 'linear_units': 320, 'learning_rate': 1.397563358688454e-05, 'optimizer': 'Adam', 'batch_size': 32, 'epochs': 5}. Best is trial 1 with value: 0.7601246105919003.
loading annotations into memory...
Done (t=0.02s)
creating index...
index created!
loading annotations into memory...
Done (t=0.01s)
creating index...
index created!
[I 2025-07-19 15:24:49,750] Trial 5 finished with value: 0.7554517133956387 and parameters: {'num_conv_layers': 1, 'conv_channels': 32, 'dropout_rate': 0.16577659872803255, 'linear_units': 448, 'learning_rate': 0.0009959183665335417, 'optimizer': 'SGD', 'batch_size': 16, 'epochs': 18}. Best is trial 1 with value: 0.7601246105919003.
loading annotations into memory...
Done (t=0.03s)
creating index...
index created!
loading annotations into memory...
Done (t=0.01s)
creating index...
index created!
[I 2025-07-19 16:14:06,819] Trial 6 finished with value: 0.5233644859813084 and parameters: {'num_conv_layers': 2, 'conv_channels': 64, 'dropout_rate': 0.23758441162052552, 'linear_units': 384, 'learning_rate': 0.003912690071022923, 'optimizer': 'Adam', 'batch_size': 64, 'epochs': 13}. Best is trial 1 with value: 0.7601246105919003.
loading annotations into memory...
Done (t=0.02s)
creating index...
index created!
loading annotations into memory...
Done (t=1.22s)
creating index...
index created!
[I 2025-07-19 16:47:23,280] Trial 7 finished with value: 0.5545171339563862 and parameters: {'num_conv_layers': 3, 'conv_channels': 32, 'dropout_rate': 0.14570807663346202, 'linear_units': 320, 'learning_rate': 0.002447145195391868, 'optimizer': 'RMSprop', 'batch_size': 32, 'epochs': 19}. Best is trial 1 with value: 0.7601246105919003.
loading annotations into memory...
Done (t=0.03s)
creating index...
index created!
loading annotations into memory...
Done (t=0.01s)
creating index...
index created!
[I 2025-07-19 17:05:17,483] Trial 8 finished with value: 0.5420560747663551 and parameters: {'num_conv_layers': 2, 'conv_channels': 16, 'dropout_rate': 0.36148377749801097, 'linear_units': 192, 'learning_rate': 0.0001974044153123472, 'optimizer': 'SGD', 'batch_size': 64, 'epochs': 17}. Best is trial 1 with value: 0.7601246105919003.
loading annotations into memory...
Done (t=0.02s)
creating index...
index created!
loading annotations into memory...
Done (t=0.01s)
creating index...
index created!
[I 2025-07-19 17:45:23,805] Trial 9 finished with value: 0.5373831775700935 and parameters: {'num_conv_layers': 1, 'conv_channels': 64, 'dropout_rate': 0.25111097812670125, 'linear_units': 192, 'learning_rate': 0.008866138413980568, 'optimizer': 'SGD', 'batch_size': 16, 'epochs': 14}. Best is trial 1 with value: 0.7601246105919003.
loading annotations into memory...
Done (t=0.02s)
creating index...
index created!
loading annotations into memory...
Done (t=0.01s)
creating index...
index created!
[I 2025-07-19 18:00:37,327] Trial 10 finished with value: 0.6261682242990654 and parameters: {'num_conv_layers': 2, 'conv_channels': 32, 'dropout_rate': 0.4945581254549492, 'linear_units': 64, 'learning_rate': 0.00010643423720051913, 'optimizer': 'Adam', 'batch_size': 32, 'epochs': 9}. Best is trial 1 with value: 0.7601246105919003.
loading annotations into memory...
Done (t=0.02s)
creating index...
index created!
loading annotations into memory...
Done (t=0.01s)
creating index...
index created!
[I 2025-07-19 18:42:56,990] Trial 11 finished with value: 0.7258566978193146 and parameters: {'num_conv_layers': 1, 'conv_channels': 32, 'dropout_rate': 0.30380376428432426, 'linear_units': 512, 'learning_rate': 0.0008303462136904971, 'optimizer': 'SGD', 'batch_size': 16, 'epochs': 20}. Best is trial 1 with value: 0.7601246105919003.
loading annotations into memory...
Done (t=0.03s)
creating index...
index created!
loading annotations into memory...
Done (t=0.01s)
creating index...
index created!
[I 2025-07-19 18:55:43,060] Trial 12 finished with value: 0.6588785046728972 and parameters: {'num_conv_layers': 3, 'conv_channels': 32, 'dropout_rate': 0.2764415407291753, 'linear_units': 512, 'learning_rate': 0.0006886181642143623, 'optimizer': 'Adam', 'batch_size': 16, 'epochs': 8}. Best is trial 1 with value: 0.7601246105919003.
loading annotations into memory...
Done (t=0.02s)
creating index...
index created!
loading annotations into memory...
Done (t=0.01s)
creating index...
index created!
[I 2025-07-19 19:09:20,012] Trial 13 finished with value: 0.6246105919003115 and parameters: {'num_conv_layers': 1, 'conv_channels': 32, 'dropout_rate': 0.18710709656890437, 'linear_units': 64, 'learning_rate': 6.874749643655546e-05, 'optimizer': 'SGD', 'batch_size': 16, 'epochs': 11}. Best is trial 1 with value: 0.7601246105919003.
loading annotations into memory...
Done (t=0.02s)
creating index...
index created!
loading annotations into memory...
Done (t=0.01s)
creating index...
index created!
[I 2025-07-19 19:39:30,082] Trial 14 finished with value: 0.7445482866043613 and parameters: {'num_conv_layers': 2, 'conv_channels': 32, 'dropout_rate': 0.1012369607811327, 'linear_units': 448, 'learning_rate': 1.0783027510064449e-05, 'optimizer': 'RMSprop', 'batch_size': 16, 'epochs': 17}. Best is trial 1 with value: 0.7601246105919003.
loading annotations into memory...
Done (t=0.02s)
creating index...
index created!
loading annotations into memory...
Done (t=0.01s)
creating index...
index created!
[I 2025-07-19 19:53:26,917] Trial 15 finished with value: 0.411214953271028 and parameters: {'num_conv_layers': 2, 'conv_channels': 32, 'dropout_rate': 0.42347870831186774, 'linear_units': 192, 'learning_rate': 0.0004276855966548943, 'optimizer': 'Adam', 'batch_size': 64, 'epochs': 8}. Best is trial 1 with value: 0.7601246105919003.
loading annotations into memory...
Done (t=0.03s)
creating index...
index created!
loading annotations into memory...
Done (t=0.01s)
creating index...
index created!
[I 2025-07-19 20:14:59,748] Trial 16 finished with value: 0.7180685358255452 and parameters: {'num_conv_layers': 1, 'conv_channels': 32, 'dropout_rate': 0.3296592479004452, 'linear_units': 128, 'learning_rate': 0.0018450428162796373, 'optimizer': 'SGD', 'batch_size': 16, 'epochs': 16}. Best is trial 1 with value: 0.7601246105919003.
loading annotations into memory...
Done (t=0.03s)
creating index...
index created!
loading annotations into memory...
Done (t=1.54s)
creating index...
index created!
[I 2025-07-19 20:32:04,895] Trial 17 finished with value: 0.764797507788162 and parameters: {'num_conv_layers': 3, 'conv_channels': 32, 'dropout_rate': 0.20095894097608075, 'linear_units': 448, 'learning_rate': 3.093307747207843e-05, 'optimizer': 'Adam', 'batch_size': 16, 'epochs': 11}. Best is trial 17 with value: 0.764797507788162.
loading annotations into memory...
Done (t=0.02s)
creating index...
index created!
loading annotations into memory...
Done (t=0.01s)
creating index...
index created!
[I 2025-07-19 20:50:26,706] Trial 18 finished with value: 0.6277258566978193 and parameters: {'num_conv_layers': 3, 'conv_channels': 32, 'dropout_rate': 0.22242017047946416, 'linear_units': 256, 'learning_rate': 2.743945761650481e-05, 'optimizer': 'Adam', 'batch_size': 32, 'epochs': 11}. Best is trial 17 with value: 0.764797507788162.
loading annotations into memory...
Done (t=0.02s)
creating index...
index created!
loading annotations into memory...
Done (t=0.01s)
creating index...
index created!
[I 2025-07-19 21:24:41,454] Trial 19 finished with value: 0.559190031152648 and parameters: {'num_conv_layers': 3, 'conv_channels': 64, 'dropout_rate': 0.28272012304864197, 'linear_units': 384, 'learning_rate': 2.626632060294854e-05, 'optimizer': 'Adam', 'batch_size': 64, 'epochs': 9}. Best is trial 17 with value: 0.764797507788162.
Best Accuracy: 0.764797507788162
Best Params: {'num_conv_layers': 3, 'conv_channels': 32, 'dropout_rate': 0.20095894097608075, 'linear_units': 448, 'learning_rate': 3.093307747207843e-05, 'optimizer': 'Adam', 'batch_size': 16, 'epochs': 11}